section_id,doc_id,doc_type,year_th,year_ce,name_short,era,regime_type,parent_doc_id,chapter_number,chapter_title,section_number,section_role,target_chapter,target_section_no,change_mode,text
const_2489_s_42,const_2489,full,2489,1946,Constitution 2489,early_democracy,civilian,,6,มาตรา 17 รัฐสภาประกอบด้วยพฤษฎล วุฒิสภาผู้แทนไม่ว่าจะประชุมแยกกันหรือรวมกัน,42,content,,,content,ในที่ประชุมแห่งสภา สมาชิกผู้ใดจะกล่าว ถ้อยคำใด ๆ ในทางแถลงข้อเท็จจริง หรือแสดงความเห็น หรือออกเสียงลงคะแนน ย่อมเป็นเอกสิทธิอันเด็ดขาด ผู้ใดจะนำไปเป็นเหตุฟ้องร้องว่ากล่าวสมาชิกผู้นั้นในทางใด ๆ มิได้ เอกสิทธินี้คุ้มครองไปถึงผู้พิมพ์และผู้โฆษณารายงานการประชุมโดยคำสั่งของสภาและคุ้มครองไปถึงบุคคลที่สภาเชิญ มาแถลงข้อเท็จจริง หรือแสดงความเห็นในที่ประชุมด้วย
const_2489_s_43,const_2489,full,2489,1946,Constitution 2489,early_democracy,civilian,,6,มาตรา 17 รัฐสภาประกอบด้วยพฤษฎล วุฒิสภาผู้แทนไม่ว่าจะประชุมแยกกันหรือรวมกัน,43,content,,,content,สมัยประชุมของพฤฒสภาและของสภาผู้แทน ย่อมเริ่มต้นและสิ้นสุดลงพร้อมกัน
const_2489_s_44,const_2489,full,2489,1946,Constitution 2489,early_democracy,civilian,,6,มาตรา 17 รัฐสภาประกอบด้วยพฤษฎล วุฒิสภาผู้แทนไม่ว่าจะประชุมแยกกันหรือรวมกัน,44,content,,,content,ในปีหนึ่งให้มีสมัยประชุมสามัญของสภาทั้งสอง สมัยหนึ่งหรือหลายสมัยแล้วแต่สภาผู้แทนจะกำหนด การประชุมครั้งแรกต้องกำหนดให้สมาชิกได้มาประชุมภายในสามสิบวันนับแต่วันเลือกตั้ง วันเริ่มสมัยประชุมสามัญประจำปีให้สภาผู้แทนเป็นผู้กำหนด ตอนที่ 30 เล่ม 25 ราชกิจจานุเบกษา 10 พฤษภาคม 2489
const_2489_s_15,const_2489,full,2489,1946,Constitution 2489,early_democracy,civilian,,6,มาตรา 17 รัฐสภาประกอบด้วยพฤษฎล วุฒิสภาผู้แทนไม่ว่าจะประชุมแยกกันหรือรวมกัน,15,content,,,content,สมัยประชุมการ ญสมัยหนึ่ง ๆ มีกำหนดเวลา เก้าสิบวัน แต่พระมหากษัตริย์ จะโปรดเกล้า ฯ ให้ขยายเวลา ออกไปก็ได้ อนึ่ง ในระหว่างเวลาเก้าสิบวันนั้น - จะโปรดเกล้า ฯ ให้ ปิดประชุมก็ได้
const_2489_s_16,const_2489,full,2489,1946,Constitution 2489,early_democracy,civilian,,6,มาตรา 17 รัฐสภาประกอบด้วยพฤษฎล วุฒิสภาผู้แทนไม่ว่าจะประชุมแยกกันหรือรวมกัน,16,content,,,content,พระมหากษัตริย์ทรงเรียกประชุมพฤฒสภา และสภาผู้แทนตามสมัยประชุม ทรงเปิดและปิดประชุม พิธีเปิดประชุมจะทรงพระกรุณาเสด็จพระราชดำเนินมา ทรงทำหรือลงโปรดเกล้า ฯ ให้รับเชตนายาที่บรรลุนิติภาวะแล้ว หรือผู้ใดผู้หนึ่งกระทำพิธีแทนพระองค์ก็ได้
const_2489_s_17,const_2489,full,2489,1946,Constitution 2489,early_democracy,civilian,,6,มาตรา 17 รัฐสภาประกอบด้วยพฤษฎล วุฒิสภาผู้แทนไม่ว่าจะประชุมแยกกันหรือรวมกัน,17,content,,,content,เมื่อเป็นการทำในเพื่อประโยชน์ของแผ่นดิน พระมหากษัตริย์จะทรงเรียกประชุมวิสามัญแห่งสภาทั้งสองก็ ได้
const_2489_s_18,const_2489,full,2489,1946,Constitution 2489,early_democracy,civilian,,6,มาตรา 17 รัฐสภาประกอบด้วยพฤษฎล วุฒิสภาผู้แทนไม่ว่าจะประชุมแยกกันหรือรวมกัน,18,content,,,content,สภาิกฤติสภาและสภาผู้แทนทั้งสองสภา หรือสมาชิกของแต่ละสภา จำนวนไม่ต่ำกว่าหนึ่งในสาม ของจำนวนสมาชิกของทั้งสองสภา มีสิทธิเข้าชื่อร้องขอให้ ตอนที่ 30 เล่ม 63 ราชกิจจานุเบกษา 10 พฤษภาคม 2489 นำความกราบบังคมทูลขอให้ทรงเรียกปราชุมวิสามัญแห่งสภา ทั้งสองได้ คำร้องขอดังกล่าวในวรรคก่อน ถ้าเป็นของสมาชิกแห่ง สภาใด ก็ให้ยื่นต่อประธานแห่งสภานั้น ถ้าเป็นของสมาชิก ทั้งสองสภา ก็ให้ยื่นต่อประธานแห่งสภาที่มีสมาชิกเข้าชื่อ มีจำนวนมากกว่า ถ้ามีจำนวนมากเท่ากัน ก็ให้ยื่นต่อประธาน พฤฒสภา ให้ประธานแห่งสภาที่ได้รับคำร้องขอนำความกราบบังคม ทูลและรับสนองพระบรมราชโองการ
const_2489_s_15,const_2489,full,2489,1946,Constitution 2489,early_democracy,civilian,,6,มาตรา 17 รัฐสภาประกอบด้วยพฤษฎล วุฒิสภาผู้แทนไม่ว่าจะประชุมแยกกันหรือรวมกัน,15,content,,,content,ในระหว่างสมัยประชุม ผู้ใดจะฟ้องสมาชิก พฤฒสภา หรือสมาชิกสภาผู้แทนในทางอาญา ศาลจะต้อง ได้รับอนุญาตจากสภาที่ผู้นั้นเป็นสมาชิกก่อนจึงพิจารณาได้ แต่การพิจารณาคดีนั้น ต้องมิให้เป็นการขัดขวางต่อการที่ สมาชิกผู้นั้นจะมาเข้าประชุม การพิจารณาคดีที่ศาลได้กระทำไปก่อนมีคำอ้างว่า จำเลย เป็นสมาชิกของสภาใดสภาหนึ่งนั้น ย่อมเป็นอันใช้ได้ 3.3 9 ตอนที่ 30 เล่ม 63 ราชกิจจานุเบกษา 10 พฤษภาคม 2499
const_2489_s_50,const_2489,full,2489,1946,Constitution 2489,early_democracy,civilian,,6,มาตรา 17 รัฐสภาประกอบด้วยพฤษฎล วุฒิสภาผู้แทนไม่ว่าจะประชุมแยกกันหรือรวมกัน,50,content,,,content,ในระหว่างสมัยประชุม ห้ามมิให้จับหรือ หมายเรียกตัวสมาชิกพฤษสภา หรือสมาชิกสภาผู้แทนไป กักขัง เว้นไว้แต่จับในขณะกระทำผิด แต่ต้องรีบรายงาน ไปยังประธานแห่งสภาที่ผู้นั้นเป็นสมาชิก ประธานแห่งสภา นั้นอาจสั่งปล่อยผู้ถูกจับให้ฟื้นจากการกักขังได้
const_2489_s_51,const_2489,full,2489,1946,Constitution 2489,early_democracy,civilian,,6,มาตรา 17 รัฐสภาประกอบด้วยพฤษฎล วุฒิสภาผู้แทนไม่ว่าจะประชุมแยกกันหรือรวมกัน,51,content,,,content,ถ้าสมาชิกพฤษสภาหรือสภาผู้แทนถูกกักขัง ในระหว่างสอบสวนหรือพิจารณาอยู่ก่อนสมัยประชุม เมื่อ ถึงสมัยประชุม พนักงานสอบสวนหรือศาลแล้วแต่กรณีจะ ต้องสั่งปล่อย ถ้าหากสภาที่ผู้นั้นเป็นสมาชิกได้ร้องขอ คำสั่งปล่อยตามความในวรรคก่อนให้มีผลบังคับตั้งแต่ วันสั่งปล่อย จนถึงวันสุดท้ายแห่งสมัยประชุม
const_2489_s_52,const_2489,full,2489,1946,Constitution 2489,early_democracy,civilian,,6,มาตรา 17 รัฐสภาประกอบด้วยพฤษฎล วุฒิสภาผู้แทนไม่ว่าจะประชุมแยกกันหรือรวมกัน,52,content,,,content,ร่างพระราชบัญญัติให้เสนอต่อสภาผู้แทนก่อน เมื่อสภาผู้แทนได้พิจารณาลงมติให้ใช้ได้แล้ว ให้นำเสนอ ต่อพฤษสภา ถ้าพฤษสภาพิจารณาลงมติเห็นชอบด้วยโดย ไม่แก้ไขแล้ว ก็ให้ดำเนินการต่อไปตามความในมาตรา 20 ถ้าหากพฤษสภาลงมติไม่เห็นชอบด้วย ก็ให้ส่งร่างพระ บัญญัตินั้นกลับคืนมาให้สภาผู้แทนพิจารณาใหม่ ถ้าสภา ตอนที่ 30 เล่ม 69 ราชกิจจานุเบกษา 10 พฤษภาคม 2559 ตู้แทนลงมติเห็นชอบตามพฤฒสภาแล้วก็ให้ถือว่าร่างพระราชบัญญัตินั้นเป็นอันตกไป ถ้าพฤฒสภาลงมติให้แก้ไขเพิ่มเติม ก็ให้ส่งร่างพระราชบัญญัตินั้นกลับคืนมาให้สภาผู้แทนพิจารณาใหม่ ถ้าสภาผู้แทนลงมติเห็นชอบตามที่พฤฒสภาแก้ไขเพิ่มเติมมา ก็ให้ดำเนินการต่อไปตามความในมาตรา 20 ถ้าหากสภาผู้แทนลงมติยืนยันตามเดิมในร่างพระราชบัญญัติที่ส่งกลับคืนมาตามความในวรรคสอง หรือวรรคสาม ด้วยคะแนนเสียงมากกว่ากึ่งของจำนวนสมาชิกทั้งหมดแล้ว ก็ให้ถือว่าร่างพระราชบัญญัตินั้น เป็นอันได้รับความเห็นชอบจากรัฐสภา และให้ดำเนินการต่อไปตามความในมาตรา 20
const_2489_s_53,const_2489,full,2489,1946,Constitution 2489,early_democracy,civilian,,6,มาตรา 17 รัฐสภาประกอบด้วยพฤษฎล วุฒิสภาผู้แทนไม่ว่าจะประชุมแยกกันหรือรวมกัน,53,content,,,content,ร่างพระราชบัญญัติเกี่ยวด้วยการเงินนั้น จะเสนอได้โดยคณะรัฐมนตรี หรือโดยสมาชิกสภาผู้แทน ซึ่งมีนายกรัฐมนตรีรับรอง ร่างพระราชบัญญัติเกี่ยวด้วยการเงินนั้น หมายความถึง ร่างพระราชบัญญัติว่าด้วยข้อความต่อไปนี้ทั้งหมด หรือแต่ข้อใดข้อหนึ่ง กล่าวคือ การตั้งขึ้นหรือยกเลิก หรือลด หรือเปลี่ยนแปลงแก้ไข หรือผ่อน หรือวางระเบียบการบังคับอัน # ตอนที่ 30 เล่ม 63 ราชกิจจานุเบกษา 10 พฤษภาคม 2495 เกี่ยวกับการภาษีหรืออากร หรือว่าด้วยเงินตรา การจัดสรร รับ รักษา หรือจ่ายเงินแผ่นดิน หรือการกู้เงิน หรือการ ประกัน หรือการใช้เงินกู้ ในกรณีเป็นที่สงสัย ให้เป็นอำนาจของประธานแห่งสภา ผู้แทนที่จะวินิจฉัยว่าร่างพระราชบัญญัติใดเป็นร่างพระราช บัญญัติเกี่ยวด้วยการเงินหรือไม่
const_2489_s_44,const_2489,full,2489,1946,Constitution 2489,early_democracy,civilian,,6,มาตรา 17 รัฐสภาประกอบด้วยพฤษฎล วุฒิสภาผู้แทนไม่ว่าจะประชุมแยกกันหรือรวมกัน,44,content,,,content,ร่างพระราชบัญญัติที่สภาผู้แทนได้ลงมติให้ ใช้ได้ และได้เสนอไปยังพฤษสถานั้น พฤฒสภาจะต้อง พิจารณาและลงมติภายในกำหนดสามสิบวัน แต่ถ้าร่าง พระราชบัญญัตินั้น เป็นร่างพระราชบัญญัติเกี่ยวด้วยการเงิน พฤฒสภาจะต้องพิจารณาและลงมติภายในกำหนดสิบห้าวัน กำหนดวันตั้งกล่าวในวรรคก่อน ให้หมายถึงวันในสมัย ประชุม และให้เริ่มนับแต่วันที่ร่างพระราชบัญญัตินั้นได้มาถึง พฤฒสภา ถ้าพฤฒสภาไม่ได้พิจารณาลงมติในร่างพระราชบัญญัติ ที่สภาผู้แทนส่งมาภายในกำหนดเวลาที่กล่าวในวรรคแรก ก็ ให้ถือว่าพฤฒสภาได้ให้ความเห็นชอบในร่างพระราชบัญญัตินั้น # 3 42 ตอนที่ 30 เล่ม 63 ราชกิจจานุเบกษา 10 พฤษภาคม 2559
const_2489_s_55,const_2489,full,2489,1946,Constitution 2489,early_democracy,civilian,,6,มาตรา 17 รัฐสภาประกอบด้วยพฤษฎล วุฒิสภาผู้แทนไม่ว่าจะประชุมแยกกันหรือรวมกัน,55,content,,,content,งบประมาณแผ่นดินประจำปี ต้องตราขึ้นเป็นพระราชบัญญัติ ถ้าพระราชบัญญัติออกไม่ทัน ปีใหม่ ให้ใช้พระราชบัญญัติปีก่อนนั้นไปทาง
const_2489_s_56,const_2489,full,2489,1946,Constitution 2489,early_democracy,civilian,,6,มาตรา 17 รัฐสภาประกอบด้วยพฤษฎล วุฒิสภาผู้แทนไม่ว่าจะประชุมแยกกันหรือรวมกัน,56,content,,,content,พฤฒสภาและสภาผู้แทน มีอำนาจควบคุมราชการแผ่นดิน โดยบทบัญญัติแห่งรัฐธรรมนูญนี้
const_2489_s_57,const_2489,full,2489,1946,Constitution 2489,early_democracy,civilian,,6,มาตรา 17 รัฐสภาประกอบด้วยพฤษฎล วุฒิสภาผู้แทนไม่ว่าจะประชุมแยกกันหรือรวมกัน,57,content,,,content,ในที่ประชุมของพฤฒสภาหรือสภาผู้แทนสมาชิกทุกคนมีสิทธิตั้งกะทู้ถามรัฐมนตรีในข้อความใด ๆ อันเกี่ยวกับการงานในหน้าที่ได้ แต่รัฐมนตรีย่อมมีสิทธิที่จะไม่ตอบ เมื่อเห็นว่าข้อความนั้น ๆ ยังไม่ควรเปิดเผยเพราะเกี่ยวกับความปลอดภัยหรือประโยชน์สำคัญของแผ่นดิน
const_2489_s_58,const_2489,full,2489,1946,Constitution 2489,early_democracy,civilian,,6,มาตรา 17 รัฐสภาประกอบด้วยพฤษฎล วุฒิสภาผู้แทนไม่ว่าจะประชุมแยกกันหรือรวมกัน,58,content,,,content,การประชุมของพฤฒสภาและสภาผู้แทน ย่อมเป็นการเปิดเผยตามลักษณะที่กำหนดไว้ในข้อบังคับของแต่ละสภา แต่ถ้าหากคณะรัฐมนตรีหรือสมาชิกของแต่ละสภาไม่ต่ำกว่ายี่สิบห้าคนร้อยละ ก็ให้ประชุมลับ
const_2489_s_59,const_2489,full,2489,1946,Constitution 2489,early_democracy,civilian,,6,มาตรา 17 รัฐสภาประกอบด้วยพฤษฎล วุฒิสภาผู้แทนไม่ว่าจะประชุมแยกกันหรือรวมกัน,59,content,,,content,พฤฒสภาและสภาผู้แทนมีอำนาจเลือกสมาชิกในสภาตั้งเป็นคณะกรรมการธิการสามัญ และมีอำนาจเลือกบุคคลที่เป็นสมาชิกหรือมิได้เป็นสมาชิกในสภาก็ตาม # ตอนที่ 30 เก็บ 63 ราชกิจจานุเบกษา 10 พฤษภาคม 2489 เป็นคณะกรรมาธิการวิสามัญ เพื่อกระทำกิจการหรือพิจารณาสอบสวนข้อความใด ๆ อันอยู่ในวงงานของสภา แล้วรายงานต่อสภา คณะกรรมาธิการที่กล่าวนี้ ย่อมมีอำนาจเรียกบุคคลใด ๆ มาชี้แจงแสดงความเห็นในกิจการที่กระทำหรือพิจารณาอยู่นั้นได้ เอลสิทธิ์ที่บัญญัติไว้ในมาตรา 42 นั้น ให้คุมครองถึงบุคคลผู้กระทำหน้าที่ตามมาตรานี้ด้วย
const_2489_s_60,const_2489,full,2489,1946,Constitution 2489,early_democracy,civilian,,6,มาตรา 17 รัฐสภาประกอบด้วยพฤษฎล วุฒิสภาผู้แทนไม่ว่าจะประชุมแยกกันหรือรวมกัน,60,content,,,content,การประชุมคณะกรรมาธิการตามมาตรา 59 นั้น ต้องมีกรรมาธิการมาประชุมไม่ต่ำกว่ากึ่งจำนวนซึ่งเป็นองค์ประชุมได้
const_2489_s_61,const_2489,full,2489,1946,Constitution 2489,early_democracy,civilian,,6,มาตรา 17 รัฐสภาประกอบด้วยพฤษฎล วุฒิสภาผู้แทนไม่ว่าจะประชุมแยกกันหรือรวมกัน,61,content,,,content,พฤติสภาพและสภาผู้แทนมีอำนาจตั้งข้อบังคับการประชุมและการปรึกษาของสภาเพื่อดำเนินการตามบทบัญญัติแห่งรัฐธรรมนูญนี้ ## ส่วนที่ 5 ### การประชุมร่วมกันของรัฐสภา
const_2489_s_62,const_2489,full,2489,1946,Constitution 2489,early_democracy,civilian,,6,มาตรา 17 รัฐสภาประกอบด้วยพฤษฎล วุฒิสภาผู้แทนไม่ว่าจะประชุมแยกกันหรือรวมกัน,62,content,,,content,ในกรณีต่อไปนี้ ให้รัฐสภาประชุมร่วมกัน # 345 ตอนที่ 30 เล่ม 23 ราชกิจจานุเบกษา 10 พฤษภาคม 2499 (1) การให้ความเห็นชอบในทางสืบราชสมบัติตาม ความในมาตรา 9 (2) การตั้งผู้สำเร็จราชการแทนพระองค์ตามความ ในมาตรา 10 (3) การปรึกษาร่างพระราชบัญญัติกันใหม่ตามความ ในมาตรา 21 (4) การเลือกตั้งซ่อมสมาชิกพฤษสภาตามความใน
