section_id,doc_id,doc_type,year_th,year_ce,name_short,era,regime_type,parent_doc_id,chapter_number,chapter_title,section_number,section_role,target_chapter,target_section_no,change_mode,text
const_2489_s_12,const_2489,full,2489,1946,Constitution 2489,early_democracy,civilian,,2,สิทธิและหน้าที่ของชนชาวไทย,12,content,,,content,บุคคลย่อมมีฐานะเสมอกันตามกฎหมายฐานันดรศักดิ์โดยกำเนิดก็ดี โดยแต่งตั้งก็ดี หรือโดยประการอื่นใดก็ดี ไม่กระทำให้เกิดเอกสิทธิอย่างใดเลย
const_2489_s_13,const_2489,full,2489,1946,Constitution 2489,early_democracy,civilian,,2,สิทธิและหน้าที่ของชนชาวไทย,13,content,,,content,บุคคลย่อมมีเสรีภาพบริบูรณ์ในการถือศาสนา หรือลัทธินิยมใด ๆ และย่อมมีเสรีภาพในการปฏิบัติพิธีกรรมตามความเชื่อถือของตน เมื่อไม่เป็นปฏิบัติการต่อหน้าที่ของพลเมือง และไม่เป็นการขัดต่อกวางสงบร้อยหรือศีลธรรมของประชาชน
const_2489_s_14,const_2489,full,2489,1946,Constitution 2489,early_democracy,civilian,,2,สิทธิและหน้าที่ของชนชาวไทย,14,content,,,content,บุคคลย่อมมีเสรีภาพบริบูรณ์ในร่างกาย เตหะสถาน ทรัพย์สิน การพูด การเขียน การพิมพ์ การ ตอนที่ 29 เล่ม 63 ราชกิจจานุเบกษา 10 พฤษภาคม 2547 โฆษณา การศึกษาอบรม การชุมนุมสาธารณะ การค้ำสมาคม การตั้งคณะพรรคการเมือง ภาษาชีพ ทั้งนี้ภายใต้บังคับแห่งบทกฎหมาย
const_2489_s_15,const_2489,full,2489,1946,Constitution 2489,early_democracy,civilian,,2,สิทธิและหน้าที่ของชนชาวไทย,15,content,,,content,บุคคลไม่มีสิทธิเสนอเรื่องราวร้องทุกข์ภายในเงื่อนไขและวิธีการที่อธิบายบัญญัติ
const_2489_s_16,const_2489,full,2489,1946,Constitution 2489,early_democracy,civilian,,2,สิทธิและหน้าที่ของชนชาวไทย,16,content,,,content,บุคคลมีหน้าที่การพูดจาหยาบ และมีหน้าที่ป้องกันประเทศ เช่น เมื่อราชอาณาจักรเสียภาษีและอื่น ๆ ภายในเงื่อนไข และโดยวิธีการที่อธิบายบัญญัติ
const_2489_s_17,const_2489,full,2489,1946,Constitution 2489,early_democracy,civilian,,6,มาตรา 17 รัฐสภาประกอบด้วยพฤษฎล วุฒิสภาผู้แทนไม่ว่าจะประชุมแยกกันหรือรวมกัน,17,content,,,content,รัฐสภาประกอบด้วยพฤษฎล วุฒิสภาผู้แทนไม่ว่าจะประชุมแยกกันหรือรวมกัน
const_2489_s_18,const_2489,full,2489,1946,Constitution 2489,early_democracy,civilian,,6,มาตรา 17 รัฐสภาประกอบด้วยพฤษฎล วุฒิสภาผู้แทนไม่ว่าจะประชุมแยกกันหรือรวมกัน,18,content,,,content,ร่างพระราชบัญญัติทั้งหลายจะเข้าขึ้นเป็นกฎหมายได้แต่โดยคำแนะนำของยินยอมตามรัฐสภา ตอนที่ 1 เล่ม 63 ราชกิจจานุเบกษา 10 พฤษภาคม 2549
const_2489_s_18,const_2489,full,2489,1946,Constitution 2489,early_democracy,civilian,,6,มาตรา 17 รัฐสภาประกอบด้วยพฤษฎล วุฒิสภาผู้แทนไม่ว่าจะประชุมแยกกันหรือรวมกัน,18,content,,,content,การตราพระราชบัญญัติขึ้นเป็นกฎหมายให้มีผลย้อนหลังเป็นการลงโทษบุคคลในทางอาญาพ้น จะกระทำมิได้
const_2489_s_20,const_2489,full,2489,1946,Constitution 2489,early_democracy,civilian,,6,มาตรา 17 รัฐสภาประกอบด้วยพฤษฎล วุฒิสภาผู้แทนไม่ว่าจะประชุมแยกกันหรือรวมกัน,20,content,,,content,ร่างพระราชบัญญัติซึ่งรัฐสภาได้ทำขึ้นเสร็จแล้ว ให้นายกรัฐมนตรีนำขึ้นทูลเกล้า ฯ ถวาย เพื่อพระมหาภารณีย์ทรงลงพระปรมาภิไธ และเมื่อได้ประกาศในราชกิจจานุเบกษาแล้ว ให้ใช้บังคับเป็นกฎหมายได้
const_2489_s_21,const_2489,full,2489,1946,Constitution 2489,early_democracy,civilian,,6,มาตรา 17 รัฐสภาประกอบด้วยพฤษฎล วุฒิสภาผู้แทนไม่ว่าจะประชุมแยกกันหรือรวมกัน,21,content,,,content,ถ้าพระมหากษัตริย์ไม่ทรงเห็นชอบด้วยร่างพระราชบัญญัตินั้น จะได้ชำระราชทานคืนมายังรัฐสภาภายในหนึ่งเดือน นับแต่วันที่นายกรัฐมนตรีนำขึ้นทูลเกล้า ฯ ถวาย ก็ดี หรือมิได้พระราชทานคืนมายังรัฐสภาภายในหนึ่งเดือนนั้นก็ดี รัฐสภาจะต้องปรึกษากันใหม่ ถ้ารัฐสภาลงมติยืนยันตามความ ให้นายกรัฐมนตรีนำร่างพระราชบัญญัตินั้นขึ้นทูลเกล้า ฯ ถวายอีกครั้งหนึ่ง เมื่อพระมหากษัตริย์มิได้ทรงลงพระปรมาภิไธพระราชทานลงมาภายในสิบห้าวันแล้ว ให้นายกรัฐมนตรีนำพระราชบัญญัตินั้นประกาศในราชกิจจานุเบกษาให้บังคับเป็นกฎหมายได้ # 330 ## ตอนที่ 10 เล่ม 63 ราชกิจจานุเบกษา 11 พฤษภาคม 2495
const_2489_s_22,const_2489,full,2489,1946,Constitution 2489,early_democracy,civilian,,6,มาตรา 17 รัฐสภาประกอบด้วยพฤษฎล วุฒิสภาผู้แทนไม่ว่าจะประชุมแยกกันหรือรวมกัน,22,content,,,content,ร่างพระราชบัญญัติทั้งหลายจะเสนอมาจาก คณะรัฐมนตรี หรือจากสมาชิกสภาผู้แทนก็ได้
const_2489_s_23,const_2489,full,2489,1946,Constitution 2489,early_democracy,civilian,,6,มาตรา 17 รัฐสภาประกอบด้วยพฤษฎล วุฒิสภาผู้แทนไม่ว่าจะประชุมแยกกันหรือรวมกัน,23,content,,,content,บุคคลใดจะเป็นสมาชิกพฤษฎหสภาและสภา ผู้แทนในขณะเดียวกันไม่ได้ ## ตอนที่ 2 พฤฒสภา
const_2489_s_24,const_2489,full,2489,1946,Constitution 2489,early_democracy,civilian,,6,มาตรา 17 รัฐสภาประกอบด้วยพฤษฎล วุฒิสภาผู้แทนไม่ว่าจะประชุมแยกกันหรือรวมกัน,24,content,,,content,พฤฒสภาประกอบด้วยสมาชิกที่ราษฎรเลือก ตั้งมีจำนวนแปดสิบคน สมาชิกพฤฒสภาต้องไม่เป็นข้าราชการประจำ การเลือกตั้งสมาชิกพฤฒสภา ให้ใช้วิธีลงคะแนนออก เสียงโดยทางอ้อม และลับ
const_2489_s_25,const_2489,full,2489,1946,Constitution 2489,early_democracy,civilian,,6,มาตรา 17 รัฐสภาประกอบด้วยพฤษฎล วุฒิสภาผู้แทนไม่ว่าจะประชุมแยกกันหรือรวมกัน,25,content,,,content,คุณสมบัติของผู้สมัครรับเลือกตั้งพฤฒสภา นี้อีกทั้งหลักเกณฑ์และวิธีการเลือกตั้ง ให้เป็นไปตามกฎหมาย ที่ศึกษา สังกัดตั้งสมาชิกพฤฒสภา แต่ผู้สมัครรับเลือกตั้ง อย่างน้อยจะต้องมีอายุไม่ต่ำกว่าสี่สิบปีบริบูรณ์ และมีทรัพย์ สินไม่ต่ำกว่าปริญญาตรีหรือเทียบเท่ามาแล้วไม่ต่ำกว่าห้าปี หรือเคยดำรงตำแหน่งทางราชการมาแล้วไม่ต่ำกว่าหัวหน้ากอง # 331 ตอนที่ 10 กม 63 ราชกิจจานุเบกษา 10 พฤษภาคม 2479 หรือเทียบก่า หรือเคยเป็นสมาชิกสภาผู้แทนหรือสมาชิก สภาผู้แทนราษฎรมาแล้ว
const_2489_s_26,const_2489,full,2489,1946,Constitution 2489,early_democracy,civilian,,6,มาตรา 17 รัฐสภาประกอบด้วยพฤษฎล วุฒิสภาผู้แทนไม่ว่าจะประชุมแยกกันหรือรวมกัน,26,content,,,content,สมาชิกภาพแห่งพฤฒสภา มีกำหนดเวลา คราวละแปดปี ฉะเพาะในเรื่องแรกเมื่อครบกำหนดสามปี ให้มีการเปลี่ยนสมาชิกถึงหนึ่งโดยวิธีขับสลาก แต่ผู้ที่ออก ไปมีสิทธิได้รับเลือกตั้งกลับเข้ามาอีก ถ้าตำแหน่งสมาชิกว่างลงเพราะเหตุอื่นนอกจากจึงตรวจ ออกตามวาระ ให้รัฐสภาเลือกบุคคลผู้มีคุณสมบัติตามความใน มาตรา 25 เข้าเป็นสมาชิกแทนตามวิธีการที่กำหนดใน กฎหมายว่าด้วยการเลือกตั้งสมาชิกพฤฒสภา สมาชิกที่เข้า มาแทนนั้นย่อมอยู่ในตำแหน่งได้เทียงเท่ากำหนดเวลาของผู้ ซึ่งตนแทน
const_2489_s_27,const_2489,full,2489,1946,Constitution 2489,early_democracy,civilian,,6,มาตรา 17 รัฐสภาประกอบด้วยพฤษฎล วุฒิสภาผู้แทนไม่ว่าจะประชุมแยกกันหรือรวมกัน,27,content,,,content,สมาชิกภาพแห่งพฤฒสภาสิ้นสุดลง เมื่อ (1) ถึงคราวออกตามวาระ (2) ตาย (3) ลาออก ตอนที่ 30 เล่ม 27 ราชกิจจานุเบกษา 10 พฤษภาคม 2536 (4) ขาดคุณสมบัติตามกฎหมายว่าด้วยการเลือกตั้งสมาชิกพุฒสภา
const_2489_s_18,const_2489,full,2489,1946,Constitution 2489,early_democracy,civilian,,6,มาตรา 17 รัฐสภาประกอบด้วยพฤษฎล วุฒิสภาผู้แทนไม่ว่าจะประชุมแยกกันหรือรวมกัน,18,content,,,content,ในระหว่างที่สภาผู้แทนราษฎร การประชุม พฤติกรรมนั้น จะกระทำมิได้ **ส่วนที่ 3** **สภาผู้แทน**
const_2489_s_29,const_2489,full,2489,1946,Constitution 2489,early_democracy,civilian,,6,มาตรา 17 รัฐสภาประกอบด้วยพฤษฎล วุฒิสภาผู้แทนไม่ว่าจะประชุมแยกกันหรือรวมกัน,29,content,,,content,สภาผู้แทนประกอบด้วยสมาชิกที่ราษฎรเลือกตั้งตามกฎหมายว่าด้วยการเลือกตั้งสมาชิกสภาผู้แทน สมาชิกสภาผู้แทนต้องไม่เป็นข้าราชการประจำ การเลื่อนตั้งสมาชิกสภาผู้แทน ให้ใช้วิธีลงคะแนนออกเสียงโดยตรงและถูกต้อง
const_2489_s_30,const_2489,full,2489,1946,Constitution 2489,early_democracy,civilian,,6,มาตรา 17 รัฐสภาประกอบด้วยพฤษฎล วุฒิสภาผู้แทนไม่ว่าจะประชุมแยกกันหรือรวมกัน,30,content,,,content,คุณสมบัติของผู้เลือกตั้งและผู้สมัครรับเลือกตั้ง อีกทั้งหลักเกณฑ์และวิธีการเลือกตั้งและจำนวนสมาชิกให้เป็นไปตามกฎหมายว่าด้วยการเลือกตั้งสมาชิกสภาผู้แทน
const_2489_s_31,const_2489,full,2489,1946,Constitution 2489,early_democracy,civilian,,6,มาตรา 17 รัฐสภาประกอบด้วยพฤษฎล วุฒิสภาผู้แทนไม่ว่าจะประชุมแยกกันหรือรวมกัน,31,content,,,content,นายกองค์การผู้แทนมีกำหนดเวลาครบสองสี่ปี 11.38 ตอนที่ 30 เล่ม 63 ราชกิจจานุเบกษา 10 พฤษภาคม 2475 ถ้าตำแหน่งสมาชิกว่างลงเพราะเหตุอื่น นอกจากถึงคราวออกตามอายุของสภาหรือยุบสภา ให้เลือกตั้งสมาชิกขึ้นแทนภายในกำหนดเวลาเก้าสิบวัน เว้นแต่อายุของสภาจะเหลือไม่ถึงหกเดือน สมาชิกที่เข้ามาแทนนั้นย่อมอยู่ในตำแหน่งได้เพียงเท่ากำหนดเวลาของผู้ซึ่งตนแทน
const_2489_s_12,const_2489,full,2489,1946,Constitution 2489,early_democracy,civilian,,6,มาตรา 17 รัฐสภาประกอบด้วยพฤษฎล วุฒิสภาผู้แทนไม่ว่าจะประชุมแยกกันหรือรวมกัน,12,content,,,content,พระมหากษัตริย์ทรงไว้ซึ่งพระราชอำนาจที่จะยุบสภาผู้แทน เพื่อให้ราษฎรเลือกตั้งสมาชิกมาใหม่ ในพระราชกฤษฎีกาให้ยุบสภา ต้องมีกำหนดเวลาให้เลือกตั้งสมาชิกใหม่ภายในเก้าสิบวัน การยุบสภาผู้แทนจะทำได้เพียงครั้งเดียวในเหตุกรณีเดียวกัน
const_2489_s_33,const_2489,full,2489,1946,Constitution 2489,early_democracy,civilian,,6,มาตรา 17 รัฐสภาประกอบด้วยพฤษฎล วุฒิสภาผู้แทนไม่ว่าจะประชุมแยกกันหรือรวมกัน,33,content,,,content,สมาชิกภาพแห่งสภาพผู้แทนสิ้นสุดลง เมื่อ (1) ถึงคราวออกตามอายุของสภาหรือยุบสภา (2) ตาย (3) ลาออก (4) ขาดคุณสมบัติตามกฎหมายว่าด้วยการเลือกตั้งสมาชิกสภาผู้แทน ตอนที่ 30 เล่ม 63 ราชกิจจานุเบกษา 10 พฤษภาคม 2499
const_2489_s_34,const_2489,full,2489,1946,Constitution 2489,early_democracy,civilian,,6,มาตรา 17 รัฐสภาประกอบด้วยพฤษฎล วุฒิสภาผู้แทนไม่ว่าจะประชุมแยกกันหรือรวมกัน,34,content,,,content,สมาชิกสภาผู้แทนมีสิทธิเสนอญัตติขอเปิดอภิปรายทั่วไปเพื่อลงมติในวาระรัฐมนตรีรายตัวหรือทั้งคณะได้ โดยมีสมาชิกรับรองไม่ต่ำกว่าสิบสี่คน การลงมติในกรณีเช่นนี้มิให้กระทำในวันเกิดวันกับวันที่ปรึกษา ## ขอนที่ 4 ### บทที่ใช้ในการทั้งสอง
const_2489_s_35,const_2489,full,2489,1946,Constitution 2489,early_democracy,civilian,,6,มาตรา 17 รัฐสภาประกอบด้วยพฤษฎล วุฒิสภาผู้แทนไม่ว่าจะประชุมแยกกันหรือรวมกัน,35,content,,,content,ก่อนเข้ามาในที่ สภาชิพพฤฒสภาและสภาผู้แทนต้องปฏิญาณในวาระชุมแห่งสภาที่ตนเป็นสมาชิกว่า จะรักษาไว้และปฏิบัติตามซึ่งรัฐธรรมนูญนี้
const_2489_s_36,const_2489,full,2489,1946,Constitution 2489,early_democracy,civilian,,6,มาตรา 17 รัฐสภาประกอบด้วยพฤษฎล วุฒิสภาผู้แทนไม่ว่าจะประชุมแยกกันหรือรวมกัน,36,content,,,content,สภาชิพพฤฒสภาและสภาผู้แทน ย่อมเป็นผู้แทนปวงชนชาวไทย ในความผูกมัดแห่งอาณัติมอบหมายใด ๆ และต้องปฏิบัติตามตามความเห็นของตนโดยบริสุทธิ์ใจ เพื่อประโยชน์แก่รวมของปวงชนชาวไทย
const_2489_s_37,const_2489,full,2489,1946,Constitution 2489,early_democracy,civilian,,6,มาตรา 17 รัฐสภาประกอบด้วยพฤษฎล วุฒิสภาผู้แทนไม่ว่าจะประชุมแยกกันหรือรวมกัน,37,content,,,content,พระบาทสมเด็จพระคัมภีร์สมาชิกพฤฒสภาและสมาชิกสภาผู้แทนตามมติของสภานั้นๆ ให้เป็นประธานแห่งสภาคนหนึ่ง เป็นรองประธานคนหนึ่งหรือหลายคนก็ได้ # 335 ตอนที่ 30 เล่ม 63 ราชกิจจานุเบกษา 10 พฤษภาคม 2499
const_2489_s_38,const_2489,full,2489,1946,Constitution 2489,early_democracy,civilian,,6,มาตรา 17 รัฐสภาประกอบด้วยพฤษฎล วุฒิสภาผู้แทนไม่ว่าจะประชุมแยกกันหรือรวมกัน,38,content,,,content,ประธานพฤฒสภา และประธานสภาผู้แทน มีหน้าที่ดำเนินกิจการของสภานั้น ๆ ให้เป็นไปตามระเบียบ รองประธานมีหน้าที่กระทำกิจการแทนประธานในเมื่อประธาน ไม่อยู่ หรือไม่สามารถปฏิบัติหน้าที่ได้
const_2489_s_39,const_2489,full,2489,1946,Constitution 2489,early_democracy,civilian,,6,มาตรา 17 รัฐสภาประกอบด้วยพฤษฎล วุฒิสภาผู้แทนไม่ว่าจะประชุมแยกกันหรือรวมกัน,39,content,,,content,ในเมื่อประธาน และรองประธานพฤฒสภา หรือสภาผู้แทนไม่อยู่ในที่ประชุม ให้สมาชิกของสภานั้น ๆ เลือกตั้งกันเองขึ้นเป็นประธานในคราวประชุมนั้น
const_2489_s_40,const_2489,full,2489,1946,Constitution 2489,early_democracy,civilian,,6,มาตรา 17 รัฐสภาประกอบด้วยพฤษฎล วุฒิสภาผู้แทนไม่ว่าจะประชุมแยกกันหรือรวมกัน,40,content,,,content,การประชุมของพฤฒสภาก็ดี หรือของ สภาผู้แทนก็ดี ทุกคราวต้องมีสมาชิกมาประชุมไม่ต่ำกว่าหนึ่ง ในสามของจำนวนสมาชิกทั้งหมด จึงเป็นองค์ประชุมได้
const_2489_s_41,const_2489,full,2489,1946,Constitution 2489,early_democracy,civilian,,6,มาตรา 17 รัฐสภาประกอบด้วยพฤษฎล วุฒิสภาผู้แทนไม่ว่าจะประชุมแยกกันหรือรวมกัน,41,content,,,content,การลงมติวินิจฉัยข้อปรึกษานั้น ให้ถือเอา เสียงข้างมากเป็นประมาณ เว้นไว้แต่เรื่องซึ่งมีบทบัญญัติไว้ เป็นพิเศษในรัฐธรรมนูญนี้ สมาชิกคนหนึ่งย่อมมีเสียงหนึ่งในการลงคะแนน ถ้ามี จำนวนเสียงลงคะแนนเท่ากัน ให้ประธานในที่ประชุมออก เสียงเพิ่มขึ้นได้อีกเสียงหนึ่งเป็นเสียงที่ขาด
